{
  "$schema": "../schema/parchete-comasare.schema.json",
  "id": "parchete-comasare",
  "title": "Munca parchetelor, redistribuită pe cele 42 de parchete județene propuse",
  "publisher": "Consiliul Superior al Magistraturii",
  "period": "2025",
  "provenance": {
    "source": "csm-starea-justitiei-2025",
    "locator": "Anexa nr. 2 și anexa activității parchetelor de pe lângă tribunale, p. 168-173",
    "confidence": "derived",
    "note": "Volumele și încărcăturile pe fiecare parchet sunt citate din anexe. Repartizarea pe județe și însumarea pe cele 42 de parchete propuse sunt calculate aici, după comasarea din capitolul 7.3."
  },
  "summary": {
    "officesBefore": 219,
    "officesAfter": 42,
    "totalVolume": 1685266,
    "totalProsecutors": 1515,
    "nationalPerProsecutor": 1112.4,
    "spreadBefore": {
      "min": 312.0,
      "max": 4483.0,
      "median": 1375.0,
      "maxOverMin": 14.37,
      "p90OverP10": 2.85
    },
    "spreadAfter": {
      "min": 586.3,
      "max": 1866.1,
      "median": 1063.0,
      "maxOverMin": 3.18,
      "p90OverP10": 2.22
    },
    "maxOverMinFalls": 11.19,
    "busiestCounty": "B",
    "busiestVolume": 305514,
    "busiestShareOfTotal": 0.181,
    "heaviestCounty": "IF",
    "heaviestPerProsecutor": 1866.1,
    "dormantOffices": [
      "ÎNSURĂŢEI"
    ],
    "activeOfficesBefore": 218,
    "resolvedByUat": [
      "SÂNNICOLAU MARE",
      "ÎNSURĂŢEI"
    ],
    "specialisedAbsorbed": [
      "BRAȘOV MINORI familie BRAŞOV"
    ]
  },
  "merged": [
    {
      "county": "AB",
      "name": "Alba",
      "officesBefore": 6,
      "volume": 20595,
      "prosecutors": 28,
      "perProsecutor": 735.5,
      "lowerVolume": 18312,
      "upperVolume": 2283
    },
    {
      "county": "AG",
      "name": "Argeș",
      "officesBefore": 6,
      "volume": 44320,
      "prosecutors": 39,
      "perProsecutor": 1136.4,
      "lowerVolume": 42610,
      "upperVolume": 1710
    },
    {
      "county": "AR",
      "name": "Arad",
      "officesBefore": 6,
      "volume": 22084,
      "prosecutors": 28,
      "perProsecutor": 788.7,
      "lowerVolume": 20740,
      "upperVolume": 1344
    },
    {
      "county": "B",
      "name": "București",
      "officesBefore": 7,
      "volume": 305514,
      "prosecutors": 260,
      "perProsecutor": 1175.1,
      "lowerVolume": 281035,
      "upperVolume": 24479
    },
    {
      "county": "BC",
      "name": "Bacău",
      "officesBefore": 6,
      "volume": 34989,
      "prosecutors": 39,
      "perProsecutor": 897.2,
      "lowerVolume": 32919,
      "upperVolume": 2070
    },
    {
      "county": "BH",
      "name": "Bihor",
      "officesBefore": 6,
      "volume": 28221,
      "prosecutors": 38,
      "perProsecutor": 742.7,
      "lowerVolume": 26784,
      "upperVolume": 1437
    },
    {
      "county": "BN",
      "name": "Bistrița-Năsăud",
      "officesBefore": 4,
      "volume": 19237,
      "prosecutors": 16,
      "perProsecutor": 1202.3,
      "lowerVolume": 17916,
      "upperVolume": 1321
    },
    {
      "county": "BR",
      "name": "Brăila",
      "officesBefore": 4,
      "volume": 23747,
      "prosecutors": 13,
      "perProsecutor": 1826.7,
      "lowerVolume": 22575,
      "upperVolume": 1172
    },
    {
      "county": "BT",
      "name": "Botoșani",
      "officesBefore": 5,
      "volume": 34826,
      "prosecutors": 23,
      "perProsecutor": 1514.2,
      "lowerVolume": 32666,
      "upperVolume": 2160
    },
    {
      "county": "BV",
      "name": "Brașov",
      "officesBefore": 6,
      "volume": 65851,
      "prosecutors": 49,
      "perProsecutor": 1343.9,
      "lowerVolume": 63769,
      "upperVolume": 2082
    },
    {
      "county": "BZ",
      "name": "Buzău",
      "officesBefore": 5,
      "volume": 24071,
      "prosecutors": 28,
      "perProsecutor": 859.7,
      "lowerVolume": 22622,
      "upperVolume": 1449
    },
    {
      "county": "CJ",
      "name": "Cluj",
      "officesBefore": 6,
      "volume": 56165,
      "prosecutors": 54,
      "perProsecutor": 1040.1,
      "lowerVolume": 52921,
      "upperVolume": 3244
    },
    {
      "county": "CL",
      "name": "Călărași",
      "officesBefore": 4,
      "volume": 20960,
      "prosecutors": 18,
      "perProsecutor": 1164.4,
      "lowerVolume": 19917,
      "upperVolume": 1043
    },
    {
      "county": "CS",
      "name": "Caraș-Severin",
      "officesBefore": 5,
      "volume": 15895,
      "prosecutors": 17,
      "perProsecutor": 935.0,
      "lowerVolume": 14896,
      "upperVolume": 999
    },
    {
      "county": "CT",
      "name": "Constanța",
      "officesBefore": 5,
      "volume": 66298,
      "prosecutors": 50,
      "perProsecutor": 1326.0,
      "lowerVolume": 62525,
      "upperVolume": 3773
    },
    {
      "county": "CV",
      "name": "Covasna",
      "officesBefore": 4,
      "volume": 12321,
      "prosecutors": 19,
      "perProsecutor": 648.5,
      "lowerVolume": 11669,
      "upperVolume": 652
    },
    {
      "county": "DB",
      "name": "Dâmbovița",
      "officesBefore": 6,
      "volume": 42115,
      "prosecutors": 29,
      "perProsecutor": 1452.2,
      "lowerVolume": 40469,
      "upperVolume": 1646
    },
    {
      "county": "DJ",
      "name": "Dolj",
      "officesBefore": 6,
      "volume": 44291,
      "prosecutors": 49,
      "perProsecutor": 903.9,
      "lowerVolume": 42409,
      "upperVolume": 1882
    },
    {
      "county": "GJ",
      "name": "Gorj",
      "officesBefore": 5,
      "volume": 24672,
      "prosecutors": 28,
      "perProsecutor": 881.1,
      "lowerVolume": 23693,
      "upperVolume": 979
    },
    {
      "county": "GL",
      "name": "Galați",
      "officesBefore": 5,
      "volume": 38243,
      "prosecutors": 28,
      "perProsecutor": 1365.8,
      "lowerVolume": 36525,
      "upperVolume": 1718
    },
    {
      "county": "GR",
      "name": "Giurgiu",
      "officesBefore": 3,
      "volume": 27693,
      "prosecutors": 18,
      "perProsecutor": 1538.5,
      "lowerVolume": 27034,
      "upperVolume": 659
    },
    {
      "county": "HD",
      "name": "Hunedoara",
      "officesBefore": 7,
      "volume": 41458,
      "prosecutors": 33,
      "perProsecutor": 1256.3,
      "lowerVolume": 40293,
      "upperVolume": 1165
    },
    {
      "county": "HR",
      "name": "Harghita",
      "officesBefore": 5,
      "volume": 12573,
      "prosecutors": 14,
      "perProsecutor": 898.1,
      "lowerVolume": 12070,
      "upperVolume": 503
    },
    {
      "county": "IF",
      "name": "Ilfov",
      "officesBefore": 3,
      "volume": 78378,
      "prosecutors": 42,
      "perProsecutor": 1866.1,
      "lowerVolume": 76916,
      "upperVolume": 1462
    },
    {
      "county": "IL",
      "name": "Ialomița",
      "officesBefore": 4,
      "volume": 28054,
      "prosecutors": 16,
      "perProsecutor": 1753.4,
      "lowerVolume": 27437,
      "upperVolume": 617
    },
    {
      "county": "IS",
      "name": "Iași",
      "officesBefore": 5,
      "volume": 83615,
      "prosecutors": 64,
      "perProsecutor": 1306.5,
      "lowerVolume": 80115,
      "upperVolume": 3500
    },
    {
      "county": "MH",
      "name": "Mehedinți",
      "officesBefore": 6,
      "volume": 19068,
      "prosecutors": 24,
      "perProsecutor": 794.5,
      "lowerVolume": 18201,
      "upperVolume": 867
    },
    {
      "county": "MM",
      "name": "Maramureș",
      "officesBefore": 6,
      "volume": 37745,
      "prosecutors": 30,
      "perProsecutor": 1258.2,
      "lowerVolume": 36484,
      "upperVolume": 1261
    },
    {
      "county": "MS",
      "name": "Mureș",
      "officesBefore": 6,
      "volume": 44869,
      "prosecutors": 40,
      "perProsecutor": 1121.7,
      "lowerVolume": 42830,
      "upperVolume": 2039
    },
    {
      "county": "NT",
      "name": "Neamț",
      "officesBefore": 5,
      "volume": 24344,
      "prosecutors": 35,
      "perProsecutor": 695.5,
      "lowerVolume": 22791,
      "upperVolume": 1553
    },
    {
      "county": "OT",
      "name": "Olt",
      "officesBefore": 5,
      "volume": 23890,
      "prosecutors": 22,
      "perProsecutor": 1085.9,
      "lowerVolume": 23104,
      "upperVolume": 786
    },
    {
      "county": "PH",
      "name": "Prahova",
      "officesBefore": 6,
      "volume": 38246,
      "prosecutors": 37,
      "perProsecutor": 1033.7,
      "lowerVolume": 37183,
      "upperVolume": 1063
    },
    {
      "county": "SB",
      "name": "Sibiu",
      "officesBefore": 6,
      "volume": 30863,
      "prosecutors": 31,
      "perProsecutor": 995.6,
      "lowerVolume": 28163,
      "upperVolume": 2700
    },
    {
      "county": "SJ",
      "name": "Sălaj",
      "officesBefore": 4,
      "volume": 12747,
      "prosecutors": 17,
      "perProsecutor": 749.8,
      "lowerVolume": 12070,
      "upperVolume": 677
    },
    {
      "county": "SM",
      "name": "Satu Mare",
      "officesBefore": 4,
      "volume": 12312,
      "prosecutors": 21,
      "perProsecutor": 586.3,
      "lowerVolume": 10806,
      "upperVolume": 1506
    },
    {
      "county": "SV",
      "name": "Suceava",
      "officesBefore": 7,
      "volume": 48999,
      "prosecutors": 37,
      "perProsecutor": 1324.3,
      "lowerVolume": 46731,
      "upperVolume": 2268
    },
    {
      "county": "TL",
      "name": "Tulcea",
      "officesBefore": 4,
      "volume": 17114,
      "prosecutors": 15,
      "perProsecutor": 1140.9,
      "lowerVolume": 16039,
      "upperVolume": 1075
    },
    {
      "county": "TM",
      "name": "Timiș",
      "officesBefore": 6,
      "volume": 50323,
      "prosecutors": 54,
      "perProsecutor": 931.9,
      "lowerVolume": 47397,
      "upperVolume": 2926
    },
    {
      "county": "TR",
      "name": "Teleorman",
      "officesBefore": 6,
      "volume": 17082,
      "prosecutors": 25,
      "perProsecutor": 683.3,
      "lowerVolume": 15973,